10:03:27.155140 IP ec2-18-218-70-252.us-east-2.compute.amazonaws.com.http > app-petngo.c.amiable-bridge-163115.internal.51729: Flags [FP.], seq 2115477695:2115477923, ack 3259294390, win 260, options [nop,nop,TS val 13705278 ecr 2484136], length 228: HTTP: HTTP/1.1 200 OK
10:03:27.155164 IP ec2-18-218-70-252.us-east-2.compute.amazonaws.com.http > 172.18.0.2.51729: Flags [FP.], seq 2115477695:2115477923, ack 3259294390, win 260, options [nop,nop,TS val 13705278 ecr 2484136], length 228: HTTP: HTTP/1.1 200 OK
10:03:27.155167 IP ec2-18-218-70-252.us-east-2.compute.amazonaws.com.http > 172.18.0.2.51729: Flags [FP.], seq 0:228, ack 1, win 260, options [nop,nop,TS val 13705278 ecr 2484136], length 228: HTTP: HTTP/1.1 200 OK
10:03:27.155271 IP 172.18.0.2.51729 > ec2-18-218-70-252.us-east-2.compute.amazonaws.com.http: Flags [F.], seq 1, ack 229, win 237, options [nop,nop,TS val 2484324 ecr 13705278], length 0
10:03:27.155271 IP 172.18.0.2.51729 > ec2-18-218-70-252.us-east-2.compute.amazonaws.com.http: Flags [F.], seq 1, ack 229, win 237, options [nop,nop,TS val 2484324 ecr 13705278], length 0
10:03:27.155291 IP app-petngo.c.amiable-bridge-163115.internal.51729 > ec2-18-218-70-252.us-east-2.compute.amazonaws.com.http: Flags [F.], seq 1, ack 229, win 237, options [nop,nop,TS val 2484324 ecr 13705278], length 0
10:03:27.155436 IP 172.18.0.2.51732 > ec2-18-218-70-252.us-east-2.compute.amazonaws.com.http: Flags [S], seq 108106459, win 29200, options [mss 1460,sackOK,TS val 2484324 ecr 0,nop,wscale 7], length 0
10:03:27.155436 IP 172.18.0.2.51732 > ec2-18-218-70-252.us-east-2.compute.amazonaws.com.http: Flags [S], seq 108106459, win 29200, options [mss 1460,sackOK,TS val 2484324 ecr 0,nop,wscale 7], length 0
10:03:27.155459 IP app-petngo.c.amiable-bridge-163115.internal.51732 > ec2-18-218-70-252.us-east-2.compute.amazonaws.com.http: Flags [S], seq 108106459, win 29200, options [mss 1460,sackOK,TS val 2484324 ecr 0,nop,wscale 7], length 0
10:03:27.188989 IP ec2-18-218-70-252.us-east-2.compute.amazonaws.com.http > app-petngo.c.amiable-bridge-163115.internal.51732: Flags [S.], seq 1358239358, ack 108106460, win 8192, options [mss 1460,nop,wscale 8,sackOK,TS val 13705282 ecr 2484324], length 0
10:03:27.189013 IP ec2-18-218-70-252.us-east-2.compute.amazonaws.com.http > 172.18.0.2.51732: Flags [S.], seq 1358239358, ack 108106460, win 8192, options [mss 1460,nop,wscale 8,sackOK,TS val 13705282 ecr 2484324], length 0
10:03:27.189016 IP ec2-18-218-70-252.us-east-2.compute.amazonaws.com.http > 172.18.0.2.51732: Flags [S.], seq 1358239358, ack 108106460, win 8192, options [mss 1460,nop,wscale 8,sackOK,TS val 13705282 ecr 2484324], length 0
10:03:27.189043 IP 172.18.0.2.51732 > ec2-18-218-70-252.us-east-2.compute.amazonaws.com.http: Flags [.], ack 1, win 229, options [nop,nop,TS val 2484332 ecr 13705282], length 0
10:03:27.189043 IP 172.18.0.2.51732 > ec2-18-218-70-252.us-east-2.compute.amazonaws.com.http: Flags [.], ack 1, win 229, options [nop,nop,TS val 2484332 ecr 13705282], length 0
10:03:27.189054 IP app-petngo.c.amiable-bridge-163115.internal.51732 > ec2-18-218-70-252.us-east-2.compute.amazonaws.com.http: Flags [.], ack 1, win 229, options [nop,nop,TS val 2484332 ecr 13705282], length 0
10:03:27.189115 IP 172.18.0.2.51732 > ec2-18-218-70-252.us-east-2.compute.amazonaws.com.http: Flags [P.], seq 1:289, ack 1, win 229, options [nop,nop,TS val 2484332 ecr 13705282], length 288: HTTP: POST /microsip_wh/functions/buscar_factura.php HTTP/1.1
10:03:27.189115 IP 172.18.0.2.51732 > ec2-18-218-70-252.us-east-2.compute.amazonaws.com.http: Flags [P.], seq 1:289, ack 1, win 229, options [nop,nop,TS val 2484332 ecr 13705282], length 288: HTTP: POST /microsip_wh/functions/buscar_factura.php HTTP/1.1
10:03:27.189130 IP app-petngo.c.amiable-bridge-163115.internal.51732 > ec2-18-218-70-252.us-east-2.compute.amazonaws.com.http: Flags [P.], seq 1:289, ack 1, win 229, options [nop,nop,TS val 2484332 ecr 13705282], length 288: HTTP: POST /microsip_wh/functions/buscar_factura.php HTTP/1.1
10:03:27.189318 IP ec2-18-218-70-252.us-east-2.compute.amazonaws.com.http > app-petngo.c.amiable-bridge-163115.internal.51729: Flags [.], ack 2, win 260, options [nop,nop,TS val 13705282 ecr 2484324], length 0
10:03:27.189326 IP ec2-18-218-70-252.us-east-2.compute.amazonaws.com.http > 172.18.0.2.51729: Flags [.], ack 2, win 260, options [nop,nop,TS val 13705282 ecr 2484324], length 0
10:03:27.189328 IP ec2-18-218-70-252.us-east-2.compute.amazonaws.com.http > 172.18.0.2.51729: Flags [.], ack 2, win 260, options [nop,nop,TS val 13705282 ecr 2484324], length 0
10:03:27.278612 IP ec2-18-218-70-252.us-east-2.compute.amazonaws.com.http > app-petngo.c.amiable-bridge-163115.internal.51730: Flags [FP.], seq 1545574970:1545575198, ack 984008074, win 260, options [nop,nop,TS val 13705291 ecr 2484187], length 228: HTTP: HTTP/1.1 200 OK
10:03:27.278647 IP ec2-18-218-70-252.us-east-2.compute.amazonaws.com.http > 172.18.0.2.51730: Flags [FP.], seq 1545574970:1545575198, ack 984008074, win 260, options [nop,nop,TS val 13705291 ecr 2484187], length 228: HTTP: HTTP/1.1 200 OK
10:03:27.278651 IP ec2-18-218-70-252.us-east-2.compute.amazonaws.com.http > 172.18.0.2.51730: Flags [FP.], seq 0:228, ack 1, win 260, options [nop,nop,TS val 13705291 ecr 2484187], length 228: HTTP: HTTP/1.1 200 OK
10:03:27.278783 IP 172.18.0.2.51730 > ec2-18-218-70-252.us-east-2.compute.amazonaws.com.http: Flags [F.], seq 1, ack 229, win 237, options [nop,nop,TS val 2484355 ecr 13705291], length 0
10:03:27.278783 IP 172.18.0.2.51730 > ec2-18-218-70-252.us-east-2.compute.amazonaws.com.http: Flags [F.], seq 1, ack 229, win 237, options [nop,nop,TS val 2484355 ecr 13705291], length 0
10:03:27.278804 IP app-petngo.c.amiable-bridge-163115.internal.51730 > ec2-18-218-70-252.us-east-2.compute.amazonaws.com.http: Flags [F.], seq 1, ack 229, win 237, options [nop,nop,TS val 2484355 ecr 13705291], length 0
10:03:27.278948 IP 172.18.0.2.51733 > ec2-18-218-70-252.us-east-2.compute.amazonaws.com.http: Flags [S], seq 1862909920, win 29200, options [mss 1460,sackOK,TS val 2484355 ecr 0,nop,wscale 7], length 0
10:03:27.278948 IP 172.18.0.2.51733 > ec2-18-218-70-252.us-east-2.compute.amazonaws.com.http: Flags [S], seq 1862909920, win 29200, options [mss 1460,sackOK,TS val 2484355 ecr 0,nop,wscale 7], length 0
10:03:27.278972 IP app-petngo.c.amiable-bridge-163115.internal.51733 > ec2-18-218-70-252.us-east-2.compute.amazonaws.com.http: Flags [S], seq 1862909920, win 29200, options [mss 1460,sackOK,TS val 2484355 ecr 0,nop,wscale 7], length 0
10:03:27.315001 IP ec2-18-218-70-252.us-east-2.compute.amazonaws.com.http > app-petngo.c.amiable-bridge-163115.internal.51733: Flags [S.], seq 2677496183, ack 1862909921, win 8192, options [mss 1460,nop,wscale 8,sackOK,TS val 13705294 ecr 2484355], length 0
10:03:27.315027 IP ec2-18-218-70-252.us-east-2.compute.amazonaws.com.http > 172.18.0.2.51733: Flags [S.], seq 2677496183, ack 1862909921, win 8192, options [mss 1460,nop,wscale 8,sackOK,TS val 13705294 ecr 2484355], length 0
10:03:27.315031 IP ec2-18-218-70-252.us-east-2.compute.amazonaws.com.http > 172.18.0.2.51733: Flags [S.], seq 2677496183, ack 1862909921, win 8192, options [mss 1460,nop,wscale 8,sackOK,TS val 13705294 ecr 2484355], length 0
10:03:27.315060 IP 172.18.0.2.51733 > ec2-18-218-70-252.us-east-2.compute.amazonaws.com.http: Flags [.], ack 1, win 229, options [nop,nop,TS val 2484364 ecr 13705294], length 0
10:03:27.315060 IP 172.18.0.2.51733 > ec2-18-218-70-252.us-east-2.compute.amazonaws.com.http: Flags [.], ack 1, win 229, options [nop,nop,TS val 2484364 ecr 13705294], length 0
10:03:27.315071 IP app-petngo.c.amiable-bridge-163115.internal.51733 > ec2-18-218-70-252.us-east-2.compute.amazonaws.com.http: Flags [.], ack 1, win 229, options [nop,nop,TS val 2484364 ecr 13705294], length 0
10:03:27.315130 IP 172.18.0.2.51733 > ec2-18-218-70-252.us-east-2.compute.amazonaws.com.http: Flags [P.], seq 1:289, ack 1, win 229, options [nop,nop,TS val 2484364 ecr 13705294], length 288: HTTP: POST /microsip_wh/functions/buscar_factura.php HTTP/1.1
10:03:27.315130 IP 172.18.0.2.51733 > ec2-18-218-70-252.us-east-2.compute.amazonaws.com.http: Flags [P.], seq 1:289, ack 1, win 229, options [nop,nop,TS val 2484364 ecr 13705294], length 288: HTTP: POST /microsip_wh/functions/buscar_factura.php HTTP/1.1
10:03:27.315145 IP app-petngo.c.amiable-bridge-163115.internal.51733 > ec2-18-218-70-252.us-east-2.compute.amazonaws.com.http: Flags [P.], seq 1:289, ack 1, win 229, options [nop,nop,TS val 2484364 ecr 13705294], length 288: HTTP: POST /microsip_wh/functions/buscar_factura.php HTTP/1.1
10:03:27.315834 IP ec2-18-218-70-252.us-east-2.compute.amazonaws.com.http > app-petngo.c.amiable-bridge-163115.internal.51730: Flags [.], ack 2, win 260, options [nop,nop,TS val 13705294 ecr 2484355], length 0
10:03:27.315844 IP ec2-18-218-70-252.us-east-2.compute.amazonaws.com.http > 172.18.0.2.51730: Flags [.], ack 2, win 260, options [nop,nop,TS val 13705294 ecr 2484355], length 0
10:03:27.315845 IP ec2-18-218-70-252.us-east-2.compute.amazonaws.com.http > 172.18.0.2.51730: Flags [.], ack 2, win 260, options [nop,nop,TS val 13705294 ecr 2484355], length 0
10:03:27.331155 IP ec2-18-218-70-252.us-east-2.compute.amazonaws.com.http > app-petngo.c.amiable-bridge-163115.internal.51732: Flags [.], ack 289, win 260, options [nop,nop,TS val 13705296 ecr 2484332], length 0
10:03:27.331177 IP ec2-18-218-70-252.us-east-2.compute.amazonaws.com.http > 172.18.0.2.51732: Flags [.], ack 289, win 260, options [nop,nop,TS val 13705296 ecr 2484332], length 0
10:03:27.331179 IP ec2-18-218-70-252.us-east-2.compute.amazonaws.com.http > 172.18.0.2.51732: Flags [.], ack 289, win 260, options [nop,nop,TS val 13705296 ecr 2484332], length 0
10:03:27.358734 IP ec2-18-218-70-252.us-east-2.compute.amazonaws.com.http > app-petngo.c.amiable-bridge-163115.internal.51731: Flags [FP.], seq 2393469142:2393469370, ack 3037425650, win 260, options [nop,nop,TS val 13705299 ecr 2484234], length 228: HTTP: HTTP/1.1 200 OK
10:03:27.358760 IP ec2-18-218-70-252.us-east-2.compute.amazonaws.com.http > 172.18.0.2.51731: Flags [FP.], seq 2393469142:2393469370, ack 3037425650, win 260, options [nop,nop,TS val 13705299 ecr 2484234], length 228: HTTP: HTTP/1.1 200 OK
10:03:27.358763 IP ec2-18-218-70-252.us-east-2.compute.amazonaws.com.http > 172.18.0.2.51731: Flags [FP.], seq 0:228, ack 1, win 260, options [nop,nop,TS val 13705299 ecr 2484234], length 228: HTTP: HTTP/1.1 200 OK
10:03:27.358852 IP 172.18.0.2.51731 > ec2-18-218-70-252.us-east-2.compute.amazonaws.com.http: Flags [F.], seq 1, ack 229, win 237, options [nop,nop,TS val 2484375 ecr 13705299], length 0
10:03:27.358852 IP 172.18.0.2.51731 > ec2-18-218-70-252.us-east-2.compute.amazonaws.com.http: Flags [F.], seq 1, ack 229, win 237, options [nop,nop,TS val 2484375 ecr 13705299], length 0
10:03:27.358871 IP app-petngo.c.amiable-bridge-163115.internal.51731 > ec2-18-218-70-252.us-east-2.compute.amazonaws.com.http: Flags [F.], seq 1, ack 229, win 237, options [nop,nop,TS val 2484375 ecr 13705299], length 0
10:03:27.358998 IP 172.18.0.2.51734 > ec2-18-218-70-252.us-east-2.compute.amazonaws.com.http: Flags [S], seq 85633927, win 29200, options [mss 1460,sackOK,TS val 2484375 ecr 0,nop,wscale 7], length 0
10:03:27.358998 IP 172.18.0.2.51734 > ec2-18-218-70-252.us-east-2.compute.amazonaws.com.http: Flags [S], seq 85633927, win 29200, options [mss 1460,sackOK,TS val 2484375 ecr 0,nop,wscale 7], length 0
10:03:27.359018 IP app-petngo.c.amiable-bridge-163115.internal.51734 > ec2-18-218-70-252.us-east-2.compute.amazonaws.com.http: Flags [S], seq 85633927, win 29200, options [mss 1460,sackOK,TS val 2484375 ecr 0,nop,wscale 7], length 0
10:03:27.392308 IP ec2-18-218-70-252.us-east-2.compute.amazonaws.com.http > app-petngo.c.amiable-bridge-163115.internal.51731: Flags [.], ack 2, win 260, options [nop,nop,TS val 13705302 ecr 2484375], length 0
10:03:27.392344 IP ec2-18-218-70-252.us-east-2.compute.amazonaws.com.http > 172.18.0.2.51731: Flags [.], ack 2, win 260, options [nop,nop,TS val 13705302 ecr 2484375], length 0
10:03:27.392346 IP ec2-18-218-70-252.us-east-2.compute.amazonaws.com.http > 172.18.0.2.51731: Flags [.], ack 2, win 260, options [nop,nop,TS val 13705302 ecr 2484375], length 0
10:03:27.392348 IP ec2-18-218-70-252.us-east-2.compute.amazonaws.com.http > app-petngo.c.amiable-bridge-163115.internal.51733: Flags [.], ack 289, win 260, options [nop,nop,TS val 13705302 ecr 2484364], length 0
10:03:27.392352 IP ec2-18-218-70-252.us-east-2.compute.amazonaws.com.http > 172.18.0.2.51733: Flags [.], ack 289, win 260, options [nop,nop,TS val 13705302 ecr 2484364], length 0
10:03:27.392352 IP ec2-18-218-70-252.us-east-2.compute.amazonaws.com.http > 172.18.0.2.51733: Flags [.], ack 289, win 260, options [nop,nop,TS val 13705302 ecr 2484364], length 0
10:03:27.392962 IP ec2-18-218-70-252.us-east-2.compute.amazonaws.com.http > app-petngo.c.amiable-bridge-163115.internal.51734: Flags [S.], seq 1518695467, ack 85633928, win 8192, options [mss 1460,nop,wscale 8,sackOK,TS val 13705302 ecr 2484375], length 0
10:03:27.392977 IP ec2-18-218-70-252.us-east-2.compute.amazonaws.com.http > 172.18.0.2.51734: Flags [S.], seq 1518695467, ack 85633928, win 8192, options [mss 1460,nop,wscale 8,sackOK,TS val 13705302 ecr 2484375], length 0
10:03:27.392979 IP ec2-18-218-70-252.us-east-2.compute.amazonaws.com.http > 172.18.0.2.51734: Flags [S.], seq 1518695467, ack 85633928, win 8192, options [mss 1460,nop,wscale 8,sackOK,TS val 13705302 ecr 2484375], length 0
10:03:27.393008 IP 172.18.0.2.51734 > ec2-18-218-70-252.us-east-2.compute.amazonaws.com.http: Flags [.], ack 1, win 229, options [nop,nop,TS val 2484383 ecr 13705302], length 0
10:03:27.393008 IP 172.18.0.2.51734 > ec2-18-218-70-252.us-east-2.compute.amazonaws.com.http: Flags [.], ack 1, win 229, options [nop,nop,TS val 2484383 ecr 13705302], length 0
10:03:27.393018 IP app-petngo.c.amiable-bridge-163115.internal.51734 > ec2-18-218-70-252.us-east-2.compute.amazonaws.com.http: Flags [.], ack 1, win 229, options [nop,nop,TS val 2484383 ecr 13705302], length 0
10:03:27.393090 IP 172.18.0.2.51734 > ec2-18-218-70-252.us-east-2.compute.amazonaws.com.http: Flags [P.], seq 1:289, ack 1, win 229, options [nop,nop,TS val 2484383 ecr 13705302], length 288: HTTP: POST /microsip_wh/functions/buscar_factura.php HTTP/1.1
10:03:27.393090 IP 172.18.0.2.51734 > ec2-18-218-70-252.us-east-2.compute.amazonaws.com.http: Flags [P.], seq 1:289, ack 1, win 229, options [nop,nop,TS val 2484383 ecr 13705302], length 288: HTTP: POST /microsip_wh/functions/buscar_factura.php HTTP/1.1
10:03:27.393104 IP app-petngo.c.amiable-bridge-163115.internal.51734 > ec2-18-218-70-252.us-east-2.compute.amazonaws.com.http: Flags [P.], seq 1:289, ack 1, win 229, options [nop,nop,TS val 2484383 ecr 13705302], length 288: HTTP: POST /microsip_wh/functions/buscar_factura.php HTTP/1.1
10:03:27.567750 IP ec2-18-218-70-252.us-east-2.compute.amazonaws.com.http > app-petngo.c.amiable-bridge-163115.internal.51734: Flags [.], ack 289, win 260, options [nop,nop,TS val 13705320 ecr 2484383], length 0
10:03:27.567797 IP ec2-18-218-70-252.us-east-2.compute.amazonaws.com.http > 172.18.0.2.51734: Flags [.], ack 289, win 260, options [nop,nop,TS val 13705320 ecr 2484383], length 0
10:03:27.567801 IP ec2-18-218-70-252.us-east-2.compute.amazonaws.com.http > 172.18.0.2.51734: Flags [.], ack 289, win 260, options [nop,nop,TS val 13705320 ecr 2484383], length 0
10:03:27.655710 IP ec2-18-206-34-84.compute-1.amazonaws.com.9030 > app-petngo.c.amiable-bridge-163115.internal.https: Flags [.], ack 619935900, win 83, options [nop,nop,TS val 2661570705 ecr 2480672], length 0
10:03:27.655739 IP ec2-18-206-34-84.compute-1.amazonaws.com.9030 > 172.18.0.4.https: Flags [.], ack 619935900, win 83, options [nop,nop,TS val 2661570705 ecr 2480672], length 0
10:03:27.655743 IP ec2-18-206-34-84.compute-1.amazonaws.com.9030 > 172.18.0.4.https: Flags [.], ack 1, win 83, options [nop,nop,TS val 2661570705 ecr 2480672], length 0
10:03:27.655758 IP 172.18.0.4.https > ec2-18-206-34-84.compute-1.amazonaws.com.9030: Flags [.], ack 1, win 243, options [nop,nop,TS val 2484449 ecr 2661510277], length 0
10:03:27.655758 IP 172.18.0.4.https > ec2-18-206-34-84.compute-1.amazonaws.com.9030: Flags [.], ack 1, win 243, options [nop,nop,TS val 2484449 ecr 2661510277], length 0
10:03:27.655767 IP app-petngo.c.amiable-bridge-163115.internal.https > ec2-18-206-34-84.compute-1.amazonaws.com.9030: Flags [.], ack 1, win 243, options [nop,nop,TS val 2484449 ecr 2661510277], length 0
10:03:27.782713 IP ec2-18-218-70-252.us-east-2.compute.amazonaws.com.http > app-petngo.c.amiable-bridge-163115.internal.51732: Flags [FP.], seq 1:229, ack 289, win 260, options [nop,nop,TS val 13705341 ecr 2484332], length 228: HTTP: HTTP/1.1 200 OK
10:03:27.782758 IP ec2-18-218-70-252.us-east-2.compute.amazonaws.com.http > 172.18.0.2.51732: Flags [FP.], seq 1:229, ack 289, win 260, options [nop,nop,TS val 13705341 ecr 2484332], length 228: HTTP: HTTP/1.1 200 OK
10:03:27.782762 IP ec2-18-218-70-252.us-east-2.compute.amazonaws.com.http > 172.18.0.2.51732: Flags [FP.], seq 1:229, ack 289, win 260, options [nop,nop,TS val 13705341 ecr 2484332], length 228: HTTP: HTTP/1.1 200 OK
10:03:27.782889 IP 172.18.0.2.51732 > ec2-18-218-70-252.us-east-2.compute.amazonaws.com.http: Flags [F.], seq 289, ack 230, win 237, options [nop,nop,TS val 2484481 ecr 13705341], length 0
10:03:27.782889 IP 172.18.0.2.51732 > ec2-18-218-70-252.us-east-2.compute.amazonaws.com.http: Flags [F.], seq 289, ack 230, win 237, options [nop,nop,TS val 2484481 ecr 13705341], length 0
10:03:27.782914 IP app-petngo.c.amiable-bridge-163115.internal.51732 > ec2-18-218-70-252.us-east-2.compute.amazonaws.com.http: Flags [F.], seq 289, ack 230, win 237, options [nop,nop,TS val 2484481 ecr 13705341], length 0
10:03:27.783058 IP 172.18.0.2.51735 > ec2-18-218-70-252.us-east-2.compute.amazonaws.com.http: Flags [S], seq 2335482391, win 29200, options [mss 1460,sackOK,TS val 2484481 ecr 0,nop,wscale 7], length 0
10:03:27.783058 IP 172.18.0.2.51735 > ec2-18-218-70-252.us-east-2.compute.amazonaws.com.http: Flags [S], seq 2335482391, win 29200, options [mss 1460,sackOK,TS val 2484481 ecr 0,nop,wscale 7], length 0
10:03:27.783082 IP app-petngo.c.amiable-bridge-163115.internal.51735 > ec2-18-218-70-252.us-east-2.compute.amazonaws.com.http: Flags [S], seq 2335482391, win 29200, options [mss 1460,sackOK,TS val 2484481 ecr 0,nop,wscale 7], length 0
10:03:27.819046 IP ec2-18-218-70-252.us-east-2.compute.amazonaws.com.http > app-petngo.c.amiable-bridge-163115.internal.51732: Flags [.], ack 290, win 260, options [nop,nop,TS val 13705345 ecr 2484481], length 0
10:03:27.819083 IP ec2-18-218-70-252.us-east-2.compute.amazonaws.com.http > 172.18.0.2.51732: Flags [.], ack 290, win 260, options [nop,nop,TS val 13705345 ecr 2484481], length 0
10:03:27.819086 IP ec2-18-218-70-252.us-east-2.compute.amazonaws.com.http > 172.18.0.2.51732: Flags [.], ack 290, win 260, options [nop,nop,TS val 13705345 ecr 2484481], length 0
10:03:27.819474 IP ec2-18-218-70-252.us-east-2.compute.amazonaws.com.http > app-petngo.c.amiable-bridge-163115.internal.51735: Flags [S.], seq 937573111, ack 2335482392, win 8192, options [mss 1460,nop,wscale 8,sackOK,TS val 13705345 ecr 2484481], length 0
10:03:27.819488 IP ec2-18-218-70-252.us-east-2.compute.amazonaws.com.http > 172.18.0.2.51735: Flags [S.], seq 937573111, ack 2335482392, win 8192, options [mss 1460,nop,wscale 8,sackOK,TS val 13705345 ecr 2484481], length 0
10:03:27.819490 IP ec2-18-218-70-252.us-east-2.compute.amazonaws.com.http > 172.18.0.2.51735: Flags [S.], seq 937573111, ack 2335482392, win 8192, options [mss 1460,nop,wscale 8,sackOK,TS val 13705345 ecr 2484481], length 0
10:03:27.819521 IP 172.18.0.2.51735 > ec2-18-218-70-252.us-east-2.compute.amazonaws.com.http: Flags [.], ack 1, win 229, options [nop,nop,TS val 2484490 ecr 13705345], length 0
10:03:27.819521 IP 172.18.0.2.51735 > ec2-18-218-70-252.us-east-2.compute.amazonaws.com.http: Flags [.], ack 1, win 229, options [nop,nop,TS val 2484490 ecr 13705345], length 0
10:03:27.819536 IP app-petngo.c.amiable-bridge-163115.internal.51735 > ec2-18-218-70-252.us-east-2.compute.amazonaws.com.http: Flags [.], ack 1, win 229, options [nop,nop,TS val 2484490 ecr 13705345], length 0
10:03:27.819609 IP 172.18.0.2.51735 > ec2-18-218-70-252.us-east-2.compute.amazonaws.com.http: Flags [P.], seq 1:289, ack 1, win 229, options [nop,nop,TS val 2484490 ecr 13705345], length 288: HTTP: POST /microsip_wh/functions/buscar_factura.php HTTP/1.1
10:03:27.819609 IP 172.18.0.2.51735 > ec2-18-218-70-252.us-east-2.compute.amazonaws.com.http: Flags [P.], seq 1:289, ack 1, win 229, options [nop,nop,TS val 2484490 ecr 13705345], length 288: HTTP: POST /microsip_wh/functions/buscar_factura.php HTTP/1.1
10:03:27.819626 IP app-petngo.c.amiable-bridge-163115.internal.51735 > ec2-18-218-70-252.us-east-2.compute.amazonaws.com.http: Flags [P.], seq 1:289, ack 1, win 229, options [nop,nop,TS val 2484490 ecr 13705345], length 288: HTTP: POST /microsip_wh/functions/buscar_factura.php HTTP/1.1
10:03:27.842077 IP ec2-18-218-70-252.us-east-2.compute.amazonaws.com.http > app-petngo.c.amiable-bridge-163115.internal.51733: Flags [FP.], seq 1:229, ack 289, win 260, options [nop,nop,TS val 13705347 ecr 2484364], length 228: HTTP: HTTP/1.1 200 OK
10:03:27.842115 IP ec2-18-218-70-252.us-east-2.compute.amazonaws.com.http > 172.18.0.2.51733: Flags [FP.], seq 1:229, ack 289, win 260, options [nop,nop,TS val 13705347 ecr 2484364], length 228: HTTP: HTTP/1.1 200 OK
10:03:27.842118 IP ec2-18-218-70-252.us-east-2.compute.amazonaws.com.http > 172.18.0.2.51733: Flags [FP.], seq 1:229, ack 289, win 260, options [nop,nop,TS val 13705347 ecr 2484364], length 228: HTTP: HTTP/1.1 200 OK
10:03:27.842235 IP 172.18.0.2.51733 > ec2-18-218-70-252.us-east-2.compute.amazonaws.com.http: Flags [F.], seq 289, ack 230, win 237, options [nop,nop,TS val 2484496 ecr 13705347], length 0
10:03:27.842235 IP 172.18.0.2.51733 > ec2-18-218-70-252.us-east-2.compute.amazonaws.com.http: Flags [F.], seq 289, ack 230, win 237, options [nop,nop,TS val 2484496 ecr 13705347], length 0
10:03:27.842255 IP app-petngo.c.amiable-bridge-163115.internal.51733 > ec2-18-218-70-252.us-east-2.compute.amazonaws.com.http: Flags [F.], seq 289, ack 230, win 237, options [nop,nop,TS val 2484496 ecr 13705347], length 0
10:03:27.842389 IP 172.18.0.2.51736 > ec2-18-218-70-252.us-east-2.compute.amazonaws.com.http: Flags [S], seq 3681052123, win 29200, options [mss 1460,sackOK,TS val 2484496 ecr 0,nop,wscale 7], length 0
10:03:27.842389 IP 172.18.0.2.51736 > ec2-18-218-70-252.us-east-2.compute.amazonaws.com.http: Flags [S], seq 3681052123, win 29200, options [mss 1460,sackOK,TS val 2484496 ecr 0,nop,wscale 7], length 0
10:03:27.842411 IP app-petngo.c.amiable-bridge-163115.internal.51736 > ec2-18-218-70-252.us-east-2.compute.amazonaws.com.http: Flags [S], seq 3681052123, win 29200, options [mss 1460,sackOK,TS val 2484496 ecr 0,nop,wscale 7], length 0
10:03:27.869074 IP ec2-18-218-70-252.us-east-2.compute.amazonaws.com.http > app-petngo.c.amiable-bridge-163115.internal.51733: Flags [.], ack 290, win 260, options [nop,nop,TS val 13705350 ecr 2484496], length 0
10:03:27.869108 IP ec2-18-218-70-252.us-east-2.compute.amazonaws.com.http > 172.18.0.2.51733: Flags [.], ack 290, win 260, options [nop,nop,TS val 13705350 ecr 2484496], length 0
10:03:27.869111 IP ec2-18-218-70-252.us-east-2.compute.amazonaws.com.http > 172.18.0.2.51733: Flags [.], ack 290, win 260, options [nop,nop,TS val 13705350 ecr 2484496], length 0
10:03:27.869453 IP ec2-18-218-70-252.us-east-2.compute.amazonaws.com.http > app-petngo.c.amiable-bridge-163115.internal.51736: Flags [S.], seq 1762487801, ack 3681052124, win 8192, options [mss 1460,nop,wscale 8,sackOK,TS val 13705350 ecr 2484496], length 0
10:03:27.869460 IP ec2-18-218-70-252.us-east-2.compute.amazonaws.com.http > 172.18.0.2.51736: Flags [S.], seq 1762487801, ack 3681052124, win 8192, options [mss 1460,nop,wscale 8,sackOK,TS val 13705350 ecr 2484496], length 0
10:03:27.869461 IP ec2-18-218-70-252.us-east-2.compute.amazonaws.com.http > 172.18.0.2.51736: Flags [S.], seq 1762487801, ack 3681052124, win 8192, options [mss 1460,nop,wscale 8,sackOK,TS val 13705350 ecr 2484496], length 0
10:03:27.869486 IP 172.18.0.2.51736 > ec2-18-218-70-252.us-east-2.compute.amazonaws.com.http: Flags [.], ack 1, win 229, options [nop,nop,TS val 2484502 ecr 13705350], length 0
10:03:27.869486 IP 172.18.0.2.51736 > ec2-18-218-70-252.us-east-2.compute.amazonaws.com.http: Flags [.], ack 1, win 229, options [nop,nop,TS val 2484502 ecr 13705350], length 0
10:03:27.869500 IP app-petngo.c.amiable-bridge-163115.internal.51736 > ec2-18-218-70-252.us-east-2.compute.amazonaws.com.http: Flags [.], ack 1, win 229, options [nop,nop,TS val 2484502 ecr 13705350], length 0
10:03:27.869574 IP 172.18.0.2.51736 > ec2-18-218-70-252.us-east-2.compute.amazonaws.com.http: Flags [P.], seq 1:289, ack 1, win 229, options [nop,nop,TS val 2484502 ecr 13705350], length 288: HTTP: POST /microsip_wh/functions/buscar_factura.php HTTP/1.1
10:03:27.869574 IP 172.18.0.2.51736 > ec2-18-218-70-252.us-east-2.compute.amazonaws.com.http: Flags [P.], seq 1:289, ack 1, win 229, options [nop,nop,TS val 2484502 ecr 13705350], length 288: HTTP: POST /microsip_wh/functions/buscar_factura.php HTTP/1.1
10:03:27.869588 IP app-petngo.c.amiable-bridge-163115.internal.51736 > ec2-18-218-70-252.us-east-2.compute.amazonaws.com.http: Flags [P.], seq 1:289, ack 1, win 229, options [nop,nop,TS val 2484502 ecr 13705350], length 288: HTTP: POST /microsip_wh/functions/buscar_factura.php HTTP/1.1
10:03:27.908925 IP ec2-18-218-70-252.us-east-2.compute.amazonaws.com.http > app-petngo.c.amiable-bridge-163115.internal.51734: Flags [FP.], seq 1:229, ack 289, win 260, options [nop,nop,TS val 13705354 ecr 2484383], length 228: HTTP: HTTP/1.1 200 OK
10:03:27.908955 IP ec2-18-218-70-252.us-east-2.compute.amazonaws.com.http > 172.18.0.2.51734: Flags [FP.], seq 1:229, ack 289, win 260, options [nop,nop,TS val 13705354 ecr 2484383], length 228: HTTP: HTTP/1.1 200 OK
10:03:27.908958 IP ec2-18-218-70-252.us-east-2.compute.amazonaws.com.http > 172.18.0.2.51734: Flags [FP.], seq 1:229, ack 289, win 260, options [nop,nop,TS val 13705354 ecr 2484383], length 228: HTTP: HTTP/1.1 200 OK
10:03:27.909085 IP 172.18.0.2.51734 > ec2-18-218-70-252.us-east-2.compute.amazonaws.com.http: Flags [F.], seq 289, ack 230, win 237, options [nop,nop,TS val 2484512 ecr 13705354], length 0
10:03:27.909085 IP 172.18.0.2.51734 > ec2-18-218-70-252.us-east-2.compute.amazonaws.com.http: Flags [F.], seq 289, ack 230, win 237, options [nop,nop,TS val 2484512 ecr 13705354], length 0
10:03:27.909106 IP app-petngo.c.amiable-bridge-163115.internal.51734 > ec2-18-218-70-252.us-east-2.compute.amazonaws.com.http: Flags [F.], seq 289, ack 230, win 237, options [nop,nop,TS val 2484512 ecr 13705354], length 0
10:03:27.909238 IP 172.18.0.2.51737 > ec2-18-218-70-252.us-east-2.compute.amazonaws.com.http: Flags [S], seq 2889761896, win 29200, options [mss 1460,sackOK,TS val 2484512 ecr 0,nop,wscale 7], length 0
10:03:27.909238 IP 172.18.0.2.51737 > ec2-18-218-70-252.us-east-2.compute.amazonaws.com.http: Flags [S], seq 2889761896, win 29200, options [mss 1460,sackOK,TS val 2484512 ecr 0,nop,wscale 7], length 0
10:03:27.909259 IP app-petngo.c.amiable-bridge-163115.internal.51737 > ec2-18-218-70-252.us-east-2.compute.amazonaws.com.http: Flags [S], seq 2889761896, win 29200, options [mss 1460,sackOK,TS val 2484512 ecr 0,nop,wscale 7], length 0
10:03:27.936434 IP ec2-18-218-70-252.us-east-2.compute.amazonaws.com.http > app-petngo.c.amiable-bridge-163115.internal.51737: Flags [S.], seq 3404133913, ack 2889761897, win 8192, options [mss 1460,nop,wscale 8,sackOK,TS val 13705356 ecr 2484512], length 0
10:03:27.936464 IP ec2-18-218-70-252.us-east-2.compute.amazonaws.com.http > 172.18.0.2.51737: Flags [S.], seq 3404133913, ack 2889761897, win 8192, options [mss 1460,nop,wscale 8,sackOK,TS val 13705356 ecr 2484512], length 0
10:03:27.936467 IP ec2-18-218-70-252.us-east-2.compute.amazonaws.com.http > 172.18.0.2.51737: Flags [S.], seq 3404133913, ack 2889761897, win 8192, options [mss 1460,nop,wscale 8,sackOK,TS val 13705356 ecr 2484512], length 0
10:03:27.936497 IP 172.18.0.2.51737 > ec2-18-218-70-252.us-east-2.compute.amazonaws.com.http: Flags [.], ack 1, win 229, options [nop,nop,TS val 2484519 ecr 13705356], length 0
10:03:27.936497 IP 172.18.0.2.51737 > ec2-18-218-70-252.us-east-2.compute.amazonaws.com.http: Flags [.], ack 1, win 229, options [nop,nop,TS val 2484519 ecr 13705356], length 0
10:03:27.936510 IP app-petngo.c.amiable-bridge-163115.internal.51737 > ec2-18-218-70-252.us-east-2.compute.amazonaws.com.http: Flags [.], ack 1, win 229, options [nop,nop,TS val 2484519 ecr 13705356], length 0
10:03:27.936548 IP ec2-18-218-70-252.us-east-2.compute.amazonaws.com.http > app-petngo.c.amiable-bridge-163115.internal.51734: Flags [.], ack 290, win 260, options [nop,nop,TS val 13705356 ecr 2484512], length 0
10:03:27.936556 IP ec2-18-218-70-252.us-east-2.compute.amazonaws.com.http > 172.18.0.2.51734: Flags [.], ack 290, win 260, options [nop,nop,TS val 13705356 ecr 2484512], length 0
10:03:27.936558 IP ec2-18-218-70-252.us-east-2.compute.amazonaws.com.http > 172.18.0.2.51734: Flags [.], ack 290, win 260, options [nop,nop,TS val 13705356 ecr 2484512], length 0
10:03:27.936576 IP 172.18.0.2.51737 > ec2-18-218-70-252.us-east-2.compute.amazonaws.com.http: Flags [P.], seq 1:289, ack 1, win 229, options [nop,nop,TS val 2484519 ecr 13705356], length 288: HTTP: POST /microsip_wh/functions/buscar_factura.php HTTP/1.1
10:03:27.936576 IP 172.18.0.2.51737 > ec2-18-218-70-252.us-east-2.compute.amazonaws.com.http: Flags [P.], seq 1:289, ack 1, win 229, options [nop,nop,TS val 2484519 ecr 13705356], length 288: HTTP: POST /microsip_wh/functions/buscar_factura.php HTTP/1.1
10:03:27.936586 IP app-petngo.c.amiable-bridge-163115.internal.51737 > ec2-18-218-70-252.us-east-2.compute.amazonaws.com.http: Flags [P.], seq 1:289, ack 1, win 229, options [nop,nop,TS val 2484519 ecr 13705356], length 288: HTTP: POST /microsip_wh/functions/buscar_factura.php HTTP/1.1
10:03:27.970542 IP ec2-18-218-70-252.us-east-2.compute.amazonaws.com.http > app-petngo.c.amiable-bridge-163115.internal.51736: Flags [.], ack 289, win 260, options [nop,nop,TS val 13705360 ecr 2484502], length 0
10:03:27.970573 IP ec2-18-218-70-252.us-east-2.compute.amazonaws.com.http > 172.18.0.2.51736: Flags [.], ack 289, win 260, options [nop,nop,TS val 13705360 ecr 2484502], length 0
10:03:27.970576 IP ec2-18-218-70-252.us-east-2.compute.amazonaws.com.http > 172.18.0.2.51736: Flags [.], ack 289, win 260, options [nop,nop,TS val 13705360 ecr 2484502], length 0
10:03:27.970986 IP ec2-18-218-70-252.us-east-2.compute.amazonaws.com.http > app-petngo.c.amiable-bridge-163115.internal.51735: Flags [.], ack 289, win 260, options [nop,nop,TS val 13705360 ecr 2484490], length 0
10:03:27.970994 IP ec2-18-218-70-252.us-east-2.compute.amazonaws.com.http > 172.18.0.2.51735: Flags [.], ack 289, win 260, options [nop,nop,TS val 13705360 ecr 2484490], length 0
10:03:27.970996 IP ec2-18-218-70-252.us-east-2.compute.amazonaws.com.http > 172.18.0.2.51735: Flags [.], ack 289, win 260, options [nop,nop,TS val 13705360 ecr 2484490], length 0
10:03:28.060684 IP ec2-18-218-70-252.us-east-2.compute.amazonaws.com.http > app-petngo.c.amiable-bridge-163115.internal.51737: Flags [.], ack 289, win 260, options [nop,nop,TS val 13705369 ecr 2484519], length 0
10:03:28.060720 IP ec2-18-218-70-252.us-east-2.compute.amazonaws.com.http > 172.18.0.2.51737: Flags [.], ack 289, win 260, options [nop,nop,TS val 13705369 ecr 2484519], length 0
10:03:28.060723 IP ec2-18-218-70-252.us-east-2.compute.amazonaws.com.http > 172.18.0.2.51737: Flags [.], ack 289, win 260, options [nop,nop,TS val 13705369 ecr 2484519], length 0
10:03:28.163824 IP metadata.google.internal.domain > app-petngo.c.amiable-bridge-163115.internal.33287: 30962 1/0/0 PTR ec2-18-218-70-252.us-east-2.compute.amazonaws.com. (107)
10:03:28.306952 IP ec2-18-218-70-252.us-east-2.compute.amazonaws.com.http > app-petngo.c.amiable-bridge-163115.internal.51736: Flags [FP.], seq 1:229, ack 289, win 260, options [nop,nop,TS val 13705394 ecr 2484502], length 228: HTTP: HTTP/1.1 200 OK
10:03:28.306987 IP ec2-18-218-70-252.us-east-2.compute.amazonaws.com.http > 172.18.0.2.51736: Flags [FP.], seq 1:229, ack 289, win 260, options [nop,nop,TS val 13705394 ecr 2484502], length 228: HTTP: HTTP/1.1 200 OK
10:03:28.306990 IP ec2-18-218-70-252.us-east-2.compute.amazonaws.com.http > 172.18.0.2.51736: Flags [FP.], seq 1:229, ack 289, win 260, options [nop,nop,TS val 13705394 ecr 2484502], length 228: HTTP: HTTP/1.1 200 OK
10:03:28.307079 IP 172.18.0.2.51736 > ec2-18-218-70-252.us-east-2.compute.amazonaws.com.http: Flags [F.], seq 289, ack 230, win 237, options [nop,nop,TS val 2484612 ecr 13705394], length 0
10:03:28.307079 IP 172.18.0.2.51736 > ec2-18-218-70-252.us-east-2.compute.amazonaws.com.http: Flags [F.], seq 289, ack 230, win 237, options [nop,nop,TS val 2484612 ecr 13705394], length 0
10:03:28.307091 IP app-petngo.c.amiable-bridge-163115.internal.51736 > ec2-18-218-70-252.us-east-2.compute.amazonaws.com.http: Flags [F.], seq 289, ack 230, win 237, options [nop,nop,TS val 2484612 ecr 13705394], length 0
10:03:28.307211 IP 172.18.0.2.51738 > ec2-18-218-70-252.us-east-2.compute.amazonaws.com.http: Flags [S], seq 3490890870, win 29200, options [mss 1460,sackOK,TS val 2484612 ecr 0,nop,wscale 7], length 0
10:03:28.307211 IP 172.18.0.2.51738 > ec2-18-218-70-252.us-east-2.compute.amazonaws.com.http: Flags [S], seq 3490890870, win 29200, options [mss 1460,sackOK,TS val 2484612 ecr 0,nop,wscale 7], length 0
10:03:28.307222 IP app-petngo.c.amiable-bridge-163115.internal.51738 > ec2-18-218-70-252.us-east-2.compute.amazonaws.com.http: Flags [S], seq 3490890870, win 29200, options [mss 1460,sackOK,TS val 2484612 ecr 0,nop,wscale 7], length 0
10:03:28.334045 IP ec2-18-218-70-252.us-east-2.compute.amazonaws.com.http > app-petngo.c.amiable-bridge-163115.internal.51738: Flags [S.], seq 663164348, ack 3490890871, win 8192, options [mss 1460,nop,wscale 8,sackOK,TS val 13705396 ecr 2484612], length 0
10:03:28.334075 IP ec2-18-218-70-252.us-east-2.compute.amazonaws.com.http > 172.18.0.2.51738: Flags [S.], seq 663164348, ack 3490890871, win 8192, options [mss 1460,nop,wscale 8,sackOK,TS val 13705396 ecr 2484612], length 0
10:03:28.334079 IP ec2-18-218-70-252.us-east-2.compute.amazonaws.com.http > 172.18.0.2.51738: Flags [S.], seq 663164348, ack 3490890871, win 8192, options [mss 1460,nop,wscale 8,sackOK,TS val 13705396 ecr 2484612], length 0
10:03:28.334110 IP 172.18.0.2.51738 > ec2-18-218-70-252.us-east-2.compute.amazonaws.com.http: Flags [.], ack 1, win 229, options [nop,nop,TS val 2484619 ecr 13705396], length 0
10:03:28.334110 IP 172.18.0.2.51738 > ec2-18-218-70-252.us-east-2.compute.amazonaws.com.http: Flags [.], ack 1, win 229, options [nop,nop,TS val 2484619 ecr 13705396], length 0
10:03:28.334122 IP app-petngo.c.amiable-bridge-163115.internal.51738 > ec2-18-218-70-252.us-east-2.compute.amazonaws.com.http: Flags [.], ack 1, win 229, options [nop,nop,TS val 2484619 ecr 13705396], length 0
10:03:28.334193 IP 172.18.0.2.51738 > ec2-18-218-70-252.us-east-2.compute.amazonaws.com.http: Flags [P.], seq 1:289, ack 1, win 229, options [nop,nop,TS val 2484619 ecr 13705396], length 288: HTTP: POST /microsip_wh/functions/buscar_factura.php HTTP/1.1
10:03:28.334193 IP 172.18.0.2.51738 > ec2-18-218-70-252.us-east-2.compute.amazonaws.com.http: Flags [P.], seq 1:289, ack 1, win 229, options [nop,nop,TS val 2484619 ecr 13705396], length 288: HTTP: POST /microsip_wh/functions/buscar_factura.php HTTP/1.1
10:03:28.334204 IP app-petngo.c.amiable-bridge-163115.internal.51738 > ec2-18-218-70-252.us-east-2.compute.amazonaws.com.http: Flags [P.], seq 1:289, ack 1, win 229, options [nop,nop,TS val 2484619 ecr 13705396], length 288: HTTP: POST /microsip_wh/functions/buscar_factura.php HTTP/1.1
10:03:28.334204 IP ec2-18-218-70-252.us-east-2.compute.amazonaws.com.http > app-petngo.c.amiable-bridge-163115.internal.51736: Flags [.], ack 290, win 260, options [nop,nop,TS val 13705396 ecr 2484612], length 0
10:03:28.334211 IP ec2-18-218-70-252.us-east-2.compute.amazonaws.com.http > 172.18.0.2.51736: Flags [.], ack 290, win 260, options [nop,nop,TS val 13705396 ecr 2484612], length 0
10:03:28.334212 IP ec2-18-218-70-252.us-east-2.compute.amazonaws.com.http > 172.18.0.2.51736: Flags [.], ack 290, win 260, options [nop,nop,TS val 13705396 ecr 2484612], length 0
10:03:28.352041 IP ec2-18-218-70-252.us-east-2.compute.amazonaws.com.http > app-petngo.c.amiable-bridge-163115.internal.51735: Flags [FP.], seq 1:229, ack 289, win 260, options [nop,nop,TS val 13705398 ecr 2484490], length 228: HTTP: HTTP/1.1 200 OK
10:03:28.352070 IP ec2-18-218-70-252.us-east-2.compute.amazonaws.com.http > 172.18.0.2.51735: Flags [FP.], seq 1:229, ack 289, win 260, options [nop,nop,TS val 13705398 ecr 2484490], length 228: HTTP: HTTP/1.1 200 OK
10:03:28.352073 IP ec2-18-218-70-252.us-east-2.compute.amazonaws.com.http > 172.18.0.2.51735: Flags [FP.], seq 1:229, ack 289, win 260, options [nop,nop,TS val 13705398 ecr 2484490], length 228: HTTP: HTTP/1.1 200 OK
10:03:28.352185 IP 172.18.0.2.51735 > ec2-18-218-70-252.us-east-2.compute.amazonaws.com.http: Flags [F.], seq 289, ack 230, win 237, options [nop,nop,TS val 2484623 ecr 13705398], length 0
10:03:28.352185 IP 172.18.0.2.51735 > ec2-18-218-70-252.us-east-2.compute.amazonaws.com.http: Flags [F.], seq 289, ack 230, win 237, options [nop,nop,TS val 2484623 ecr 13705398], length 0
10:03:28.352199 IP app-petngo.c.amiable-bridge-163115.internal.51735 > ec2-18-218-70-252.us-east-2.compute.amazonaws.com.http: Flags [F.], seq 289, ack 230, win 237, options [nop,nop,TS val 2484623 ecr 13705398], length 0
10:03:28.352322 IP 172.18.0.2.51739 > ec2-18-218-70-252.us-east-2.compute.amazonaws.com.http: Flags [S], seq 3743786160, win 29200, options [mss 1460,sackOK,TS val 2484623 ecr 0,nop,wscale 7], length 0
10:03:28.352322 IP 172.18.0.2.51739 > ec2-18-218-70-252.us-east-2.compute.amazonaws.com.http: Flags [S], seq 3743786160, win 29200, options [mss 1460,sackOK,TS val 2484623 ecr 0,nop,wscale 7], length 0
10:03:28.352333 IP app-petngo.c.amiable-bridge-163115.internal.51739 > ec2-18-218-70-252.us-east-2.compute.amazonaws.com.http: Flags [S], seq 3743786160, win 29200, options [mss 1460,sackOK,TS val 2484623 ecr 0,nop,wscale 7], length 0
10:03:28.379655 IP ec2-18-218-70-252.us-east-2.compute.amazonaws.com.http > app-petngo.c.amiable-bridge-163115.internal.51739: Flags [S.], seq 748987882, ack 3743786161, win 8192, options [mss 1460,nop,wscale 8,sackOK,TS val 13705401 ecr 2484623], length 0
10:03:28.379686 IP ec2-18-218-70-252.us-east-2.compute.amazonaws.com.http > 172.18.0.2.51739: Flags [S.], seq 748987882, ack 3743786161, win 8192, options [mss 1460,nop,wscale 8,sackOK,TS val 13705401 ecr 2484623], length 0
10:03:28.379688 IP ec2-18-218-70-252.us-east-2.compute.amazonaws.com.http > 172.18.0.2.51739: Flags [S.], seq 748987882, ack 3743786161, win 8192, options [mss 1460,nop,wscale 8,sackOK,TS val 13705401 ecr 2484623], length 0
10:03:28.379718 IP 172.18.0.2.51739 > ec2-18-218-70-252.us-east-2.compute.amazonaws.com.http: Flags [.], ack 1, win 229, options [nop,nop,TS val 2484630 ecr 13705401], length 0
10:03:28.379718 IP 172.18.0.2.51739 > ec2-18-218-70-252.us-east-2.compute.amazonaws.com.http: Flags [.], ack 1, win 229, options [nop,nop,TS val 2484630 ecr 13705401], length 0
10:03:28.379726 IP app-petngo.c.amiable-bridge-163115.internal.51739 > ec2-18-218-70-252.us-east-2.compute.amazonaws.com.http: Flags [.], ack 1, win 229, options [nop,nop,TS val 2484630 ecr 13705401], length 0
